{
  "schema": "tokmd.packets/v1",
  "producer": {
    "name": "unsafe-review",
    "version": "fixture",
    "tokmd_run": false
  },
  "inputs_present": [
    "tokmd-packets.json",
    "manual-candidates.json",
    "cards.json"
  ],
  "inputs_absent": [
    "comment-plan.json",
    "witness-plan.md"
  ],
  "non_claims": [
    "Does not prove undefined behavior.",
    "Does not prove memory safety.",
    "Does not prove Miri-clean status.",
    "Does not provide a merge verdict."
  ],
  "preset_inputs": {
    "bun-ub-handoff": {
      "sections": {
        "candidate_identity": "manual candidate seed-42 / ReviewCard rc-17",
        "stable_byte_family": "MarkdownObject UTF-8 boundary",
        "proof_mode": "manual witness required",
        "suggested_fix_boundary": "narrow UTF-8 validation at JS seam only"
      },
      "limitations": [
        "witness-plan.md absent from bundle"
      ],
      "missing_sections": [
        "test or witness target"
      ]
    },
    "bun-ub-pr-body": {
      "sections": {
        "problem_statement": "Scoped UTF-8 handling may read past buffer on malformed input.",
        "smallest_changed_surface": "src/runtime/api/MarkdownObject.rs only",
        "exact_claims_not_made": "No UB proof; no runtime oracle executed by this packet."
      },
      "limitations": [],
      "missing_sections": []
    }
  }
}
